,Index,display_url,comments,is_video,likes,caption,labels,labels_strings,likes_normalized,comments_normalized,engagement_score,engagement,caption+labels,label_tokens,topic0,topic1,topic2,topic3,topic4,topic5,topic6,topic7,topic8,topic9
218,234,https://instagram.fftw1-1.fna.fbcdn.net/v/t51.2885-15/fr/e15/p1080x1080/73263092_2422558778015241_3123186851465771602_n.jpg?_nc_ht=instagram.fftw1-1.fna.fbcdn.net&_nc_cat=109&oh=6d6a9e6bcbc4672c0ac884606df1a148&oe=5E893E37,864,False,288036,"Photo by Acacia Johnson @acacia.johnson | Nat Geo is celebrating women who fearlessly push boundaries and inspire the next generation of changemakers. For the next week, all of our posts and stories on @natgeo will be photographed by women, about women.\n\nPolar expedition guide Françoise Gervais plays her accordion on the stern of a ship near the Lemaire Channel in Antarctica. Originally from Quebec, Françoise is a deep-sea explorer, environmental conservation specialist, polar expedition leader, and cold-water diver—and one of the many remarkable women I\'ve photographed as part of an ongoing series about women who work in Antarctica. “What I’ve realized over the years is that a lot of women don’t realize they can do things: go on expeditions, take leadership roles, or work in extreme environments,"" she says. ""It’s not even in their subconscious. A lot of people don’t even consider guiding in the polar regions an option as a woman—and leading is a whole other story. You imagine Shackleton or Scott or Franklin. We keep hearing their names again and again. And we don’t even hear about the women.” Follow me @acacia.johnson for more stories from Antarctica and beyond. #antarctica #womeninantarctica #polar\n\nUse #NatGeoWomenofImpact to share how a woman in your life has empowered you.'","['accordion', 'free', 'reed', 'aerophone', 'garmon', 'musical', 'instrument', 'accordionist', 'diatonic', 'button', 'accordion', 'squeezebox', 'folk', 'instrument', 'concertina', 'trikiti']",accordion free reed aerophone garmon musical instrument accordionist diatonic button accordion squeezebox folk instrument concertina trikiti,0.17822708490345382,0.06637474072366904,0.11111567839558295,0,"Photo by Acacia Johnson @acacia.johnson | Nat Geo is celebrating women who fearlessly push boundaries and inspire the next generation of changemakers. For the next week, all of our posts and stories on @natgeo will be photographed by women, about women.\n\nPolar expedition guide Françoise Gervais plays her accordion on the stern of a ship near the Lemaire Channel in Antarctica. Originally from Quebec, Françoise is a deep-sea explorer, environmental conservation specialist, polar expedition leader, and cold-water diver—and one of the many remarkable women I\'ve photographed as part of an ongoing series about women who work in Antarctica. “What I’ve realized over the years is that a lot of women don’t realize they can do things: go on expeditions, take leadership roles, or work in extreme environments,"" she says. ""It’s not even in their subconscious. A lot of people don’t even consider guiding in the polar regions an option as a woman—and leading is a whole other story. You imagine Shackleton or Scott or Franklin. We keep hearing their names again and again. And we don’t even hear about the women.” Follow me @acacia.johnson for more stories from Antarctica and beyond. #antarctica #womeninantarctica #polar\n\nUse #NatGeoWomenofImpact to share how a woman in your life has empowered you.' accordion free reed aerophone garmon musical instrument accordionist diatonic button accordion squeezebox folk instrument concertina trikiti","['accordion', 'free', 'reed', 'aerophone', 'garmon', 'musical', 'instrument', 'accordionist', 'diatonic', 'button', 'accordion', 'squeezebox', 'folk', 'instrument', 'concertina', 'trikiti']",0.10000000149011612,0.10000000149011612,0.10000000149011612,0.10000000149011612,0.10000000149011612,0.10000000149011612,0.10000000149011612,0.10000000149011612,0.10000000149011612,0.10000000149011612
219,235,https://instagram.fftw1-1.fna.fbcdn.net/v/t51.2885-15/fr/e15/s1080x1080/71846443_552085512192336_5515717967858608643_n.jpg?_nc_ht=instagram.fftw1-1.fna.fbcdn.net&_nc_cat=100&oh=c4473179163ef5a99ba902a350a99b81&oe=5E77EEF7,2035,False,375697,"Photo by Lynn Johnson @ljohnphoto | The November issue of National Geographic magazine discusses the state of women in the world today. Many women are rising up, fighting back, and succeeding in business and science. But this child, married at 13 years old, will remain invisible most of her life. She is flanked by her new husband and his best man. According to UNICEF, worldwide, one in three girls are married before the age of 15.\n\nNat Geo is celebrating women who fearlessly push boundaries and inspire the next generation of changemakers. For a week, all of our posts and stories on @natgeo were photographed by women, about women. Use #NatGeoWomenofImpact to share how a woman in your life has empowered you.'","['people', 'ritual', 'tribe', 'tradition', 'temple', 'ceremony']",people ritual tribe tradition temple ceremony,0.23246879250153762,0.15633402473688254,0.18678793184274456,1,"Photo by Lynn Johnson @ljohnphoto | The November issue of National Geographic magazine discusses the state of women in the world today. Many women are rising up, fighting back, and succeeding in business and science. But this child, married at 13 years old, will remain invisible most of her life. She is flanked by her new husband and his best man. According to UNICEF, worldwide, one in three girls are married before the age of 15.\n\nNat Geo is celebrating women who fearlessly push boundaries and inspire the next generation of changemakers. For a week, all of our posts and stories on @natgeo were photographed by women, about women. Use #NatGeoWomenofImpact to share how a woman in your life has empowered you.' people ritual tribe tradition temple ceremony","['people', 'ritual', 'tribe', 'tradition', 'temple', 'ceremony']",0.025000736117362976,0.025002043694257736,0.025000544264912605,0.02500006929039955,0.02500006929039955,0.025000223889946938,0.02500006929039955,0.02500006929039955,0.7749959230422974,0.025000302121043205
220,236,https://instagram.fftw1-1.fna.fbcdn.net/v/t51.2885-15/fr/e15/s1080x1080/72967606_179272379792491_4550613646076775057_n.jpg?_nc_ht=instagram.fftw1-1.fna.fbcdn.net&_nc_cat=107&oh=2b081ed12c43f66475396cf4ec2aa4ec&oe=5E74DAF6,2945,False,508275,"Photo by Ami Vitale @amivitale | Mary Lengees, one of the first female elephant keepers at Reteti Elephant Sanctuary in northern Kenya, caresses Suyian, the first resident. The dedicated keepers here provide round-the-clock care to the most vulnerable elephants to ensure the best outcomes, staying with them throughout the night. Mary is a trailblazer and an inspiration to me and to all who know her. She is one of the very first indigenous Samburu keepers in all of Africa. Although the idea of women working outside of the home is new here, the community has embraced the program. When the seven women keepers return to their homes, the people in their villages rush to them to hear news about the elephants in their care. \nFollow @amivitale and @r.e.s.c.u.e to get involved and support this crucial work.\n@conservationorg @thephotosociety @natgeoimagecollection #protectelephants #elephants #stoppoaching #kenya #worthmorealive\n\nNat Geo is celebrating women who fearlessly push boundaries and inspire the next generation of changemakers. For a week, all of our posts and stories on @natgeo were photographed by women, about women. Use #NatGeoWomenofImpact to share how a woman in your life has empowered you.'","['human', 'tree', 'adaptation', 'plant', 'rock', 'art']",human tree adaptation plant rock art,0.31450364391709024,0.22624260582315434,0.2615470210607287,1,"Photo by Ami Vitale @amivitale | Mary Lengees, one of the first female elephant keepers at Reteti Elephant Sanctuary in northern Kenya, caresses Suyian, the first resident. The dedicated keepers here provide round-the-clock care to the most vulnerable elephants to ensure the best outcomes, staying with them throughout the night. Mary is a trailblazer and an inspiration to me and to all who know her. She is one of the very first indigenous Samburu keepers in all of Africa. Although the idea of women working outside of the home is new here, the community has embraced the program. When the seven women keepers return to their homes, the people in their villages rush to them to hear news about the elephants in their care. \nFollow @amivitale and @r.e.s.c.u.e to get involved and support this crucial work.\n@conservationorg @thephotosociety @natgeoimagecollection #protectelephants #elephants #stoppoaching #kenya #worthmorealive\n\nNat Geo is celebrating women who fearlessly push boundaries and inspire the next generation of changemakers. For a week, all of our posts and stories on @natgeo were photographed by women, about women. Use #NatGeoWomenofImpact to share how a woman in your life has empowered you.' human tree adaptation plant rock art","['human', 'tree', 'adaptation', 'plant', 'rock', 'art']",0.35951319336891174,0.014286607503890991,0.014286728575825691,0.014286752790212631,0.5261944532394409,0.014286323450505733,0.014286400750279427,0.014285755343735218,0.014288040809333324,0.014285755343735218
221,237,https://instagram.fftw1-1.fna.fbcdn.net/v/t51.2885-15/fr/e15/s1080x1080/75272122_397780774495444_2565717468213518751_n.jpg?_nc_ht=instagram.fftw1-1.fna.fbcdn.net&_nc_cat=104&oh=3fdcc7178cede29da9681619273317ea&oe=5E7F21AA,656,False,276007,"Photo by Michaela Skovranova @mishkusk | My underwater journey began at Shelly Beach in Sydney, Australia. I remember seeing a group of women swim by and playfully dive under the sea, encouraging each other as they explored and pushed their own boundaries. I feel like this gentle encouragement and playfulness is a beautiful part of womanhood and it’s something I continue to explore in my personal work. \n#women #nature #underwater #Sydney #Australia\n\nNat Geo is celebrating women who fearlessly push boundaries and inspire the next generation of changemakers. For a week, all of our posts and stories on @natgeo were photographed by women, about women. Use #NatGeoWomenofImpact to share how a woman in your life has empowered you.'","['water', 'underwater', 'organism', 'swimming', 'photography', 'sunlight', 'sea', 'recreation', 'marine', 'biology']",water underwater organism swimming photography sunlight sea recreation marine biology,0.17078394028158836,0.05039563647537835,0.09855095799786236,0,"Photo by Michaela Skovranova @mishkusk | My underwater journey began at Shelly Beach in Sydney, Australia. I remember seeing a group of women swim by and playfully dive under the sea, encouraging each other as they explored and pushed their own boundaries. I feel like this gentle encouragement and playfulness is a beautiful part of womanhood and it’s something I continue to explore in my personal work. \n#women #nature #underwater #Sydney #Australia\n\nNat Geo is celebrating women who fearlessly push boundaries and inspire the next generation of changemakers. For a week, all of our posts and stories on @natgeo were photographed by women, about women. Use #NatGeoWomenofImpact to share how a woman in your life has empowered you.' water underwater organism swimming photography sunlight sea recreation marine biology","['water', 'underwater', 'organism', 'swimming', 'photography', 'sunlight', 'sea', 'recreation', 'marine', 'biology']",0.5598174929618835,0.011112947016954422,0.14668869972229004,0.011111379601061344,0.011111223138868809,0.01111163292080164,0.011111235246062279,0.2157120704650879,0.011112143285572529,0.01111114677041769
222,238,https://instagram.fftw1-1.fna.fbcdn.net/v/t51.2885-15/e35/s1080x1080/73263682_872203339863572_8516149119806283568_n.jpg?_nc_ht=instagram.fftw1-1.fna.fbcdn.net&_nc_cat=108&oh=95da8a5a22946eae4baf561a374547c9&oe=5E743189,629,False,243963,"Photo by Stephen Alvarez @salvarezphoto // Sponsored by @salesforce // In the Tennessee River Gorge the eastern hardwood forest is the basis of a complex ecosystem that flourishes in a rapidly urbanizing part of the United States. The land is protected by the Tennessee River Gorge Trust, the state of Tennessee, and the Tennessee Valley Authority. A mature forest like this also acts as an effective carbon sink. In 2017 the Tennessee River Gorge Trust placed 6,000 acres of its land in the carbon offset market, locking up over 225,000 metric tons of carbon. // According to the Intergovernmental Panel on Climate Change (IPCC) Special Report on Climate Change and Land, the loss of healthy forests is a key cause of climate change. In the lead-up to COP25, the next UN meeting on #climateaction, @unfoundation encourages you to spotlight solutions to climate change using the hashtag #EyeOnClimate.'","['nature', 'sky', 'natural', 'landscape', 'wilderness', 'hill', 'highland', 'mountain', 'river', 'reservoir', 'fell']",nature sky natural landscape wilderness hill highland mountain river reservoir fell,0.1509561801799126,0.04832142582776369,0.08937532756862326,0,"Photo by Stephen Alvarez @salvarezphoto // Sponsored by @salesforce // In the Tennessee River Gorge the eastern hardwood forest is the basis of a complex ecosystem that flourishes in a rapidly urbanizing part of the United States. The land is protected by the Tennessee River Gorge Trust, the state of Tennessee, and the Tennessee Valley Authority. A mature forest like this also acts as an effective carbon sink. In 2017 the Tennessee River Gorge Trust placed 6,000 acres of its land in the carbon offset market, locking up over 225,000 metric tons of carbon. // According to the Intergovernmental Panel on Climate Change (IPCC) Special Report on Climate Change and Land, the loss of healthy forests is a key cause of climate change. In the lead-up to COP25, the next UN meeting on #climateaction, @unfoundation encourages you to spotlight solutions to climate change using the hashtag #EyeOnClimate.' nature sky natural landscape wilderness hill highland mountain river reservoir fell","['nature', 'sky', 'natural', 'landscape', 'wilderness', 'hill', 'highland', 'mountain', 'river', 'reservoir', 'fell']",0.014285750687122345,0.01428581215441227,0.014285928569734097,0.014285750687122345,0.014288358390331268,0.014286497607827187,0.8714239001274109,0.014286280609667301,0.014285750687122345,0.01428600400686264
223,239,https://instagram.fftw1-1.fna.fbcdn.net/v/t51.2885-15/fr/e15/p1080x1080/75208786_549074162521166_584471688399114781_n.jpg?_nc_ht=instagram.fftw1-1.fna.fbcdn.net&_nc_cat=102&oh=a660268779694fb8304870d64693f5f5&oe=5E68DFF9,609,False,176204,"Photo by Nora Lorek @noralorek | Lea Kadi, 67, can often be found selling coffee while seated in the shadow of her house. In South Sudan, she worked as a midwife for 35 years. Now, with a handful of customers in the neighborhood, she makes less than one dollar a week.\n\nThe civil war in South Sudan has displaced two million people. When refugees arrived to Uganda they carried their only possessions wrapped in milayas, embroidered sheets passed down for generations. Today in Bidibidi, the second largest refugee camp in the world, milayas are being sewn but there are few customers. Through the Milaya Project these women will be able to sell their art and transform their collectives into self-sufficient businesses. Follow @milayaproject for more information on how to support these women.\n\nNat Geo is celebrating women who fearlessly push boundaries and inspire the next generation of changemakers. For a week, all of our posts and stories on @natgeo were photographed by women, about women. Use #NatGeoWomenofImpact to share how a woman in your life has empowered you.'","['people', 'tribal', 'chief', 'tribe', 'human', 'headgear', 'stock', 'photography', 'art']",people tribal chief tribe human headgear stock photography art,0.10902916742465588,0.04678497349619728,0.07168265106758072,0,"Photo by Nora Lorek @noralorek | Lea Kadi, 67, can often be found selling coffee while seated in the shadow of her house. In South Sudan, she worked as a midwife for 35 years. Now, with a handful of customers in the neighborhood, she makes less than one dollar a week.\n\nThe civil war in South Sudan has displaced two million people. When refugees arrived to Uganda they carried their only possessions wrapped in milayas, embroidered sheets passed down for generations. Today in Bidibidi, the second largest refugee camp in the world, milayas are being sewn but there are few customers. Through the Milaya Project these women will be able to sell their art and transform their collectives into self-sufficient businesses. Follow @milayaproject for more information on how to support these women.\n\nNat Geo is celebrating women who fearlessly push boundaries and inspire the next generation of changemakers. For a week, all of our posts and stories on @natgeo were photographed by women, about women. Use #NatGeoWomenofImpact to share how a woman in your life has empowered you.' people tribal chief tribe human headgear stock photography art","['people', 'tribal', 'chief', 'tribe', 'human', 'headgear', 'stock', 'photography', 'art']",0.8199726939201355,0.020010797306895256,0.020003315061330795,0.020000074058771133,0.020000074058771133,0.02000180259346962,0.020000074058771133,0.020000074058771133,0.02001040056347847,0.020000647753477097
224,240,https://instagram.fftw1-1.fna.fbcdn.net/v/t51.2885-15/e15/71507792_125641711802355_9215614148308026008_n.jpg?_nc_ht=instagram.fftw1-1.fna.fbcdn.net&_nc_cat=103&oh=e6ae83e90a0d0508ad1b51b35af92fe1&oe=5E82FEFB,611,False,206593,"Photo by Karla Gachet @kchete77 | \nNat Geo is celebrating women who fearlessly push boundaries and inspire the next generation of changemakers. For the next week, all of our posts and stories on @natgeo will be photographed by women, about women.\n\nOmentoke Omene, 26, and her one- month-old baby girl go into the field to plant plantain and cut down some smaller trees, leaving room for the yuca (manioc) to grow. They are Huaorani from the community of Noneno, located along the Shiripuno River in the Amazon rainforest. Women are more likely to take care of their crops to feed their family. #amazonwomen\n\nUse #NatGeoWomenofImpact to share how a woman in your life has empowered you.'","['green', 'jungle', 'natural', 'environment', 'pink', 'botany', 'rainforest', 'organism', 'terrestrial', 'plant', 'tree', 'plant']",green jungle natural environment pink botany rainforest organism terrestrial plant tree plant,0.1278328686395424,0.04693861872935392,0.07929631869342932,0,"Photo by Karla Gachet @kchete77 | \nNat Geo is celebrating women who fearlessly push boundaries and inspire the next generation of changemakers. For the next week, all of our posts and stories on @natgeo will be photographed by women, about women.\n\nOmentoke Omene, 26, and her one- month-old baby girl go into the field to plant plantain and cut down some smaller trees, leaving room for the yuca (manioc) to grow. They are Huaorani from the community of Noneno, located along the Shiripuno River in the Amazon rainforest. Women are more likely to take care of their crops to feed their family. #amazonwomen\n\nUse #NatGeoWomenofImpact to share how a woman in your life has empowered you.' green jungle natural environment pink botany rainforest organism terrestrial plant tree plant","['green', 'jungle', 'natural', 'environment', 'pink', 'botany', 'rainforest', 'organism', 'terrestrial', 'plant', 'tree', 'plant']",0.15713898837566376,0.01428600400686264,0.014285782352089882,0.014287859201431274,0.7285624742507935,0.014287863858044147,0.01428605429828167,0.014291356317698956,0.014285782352089882,0.014287777245044708
225,241,https://instagram.fftw1-1.fna.fbcdn.net/v/t51.2885-15/fr/e15/p1080x1080/73140174_155554155648935_5847373878243964657_n.jpg?_nc_ht=instagram.fftw1-1.fna.fbcdn.net&_nc_cat=111&oh=93e6012fe1c5c92a008767c6e0611637&oe=5E84BB30,1523,False,244140,"Photo by Erika Larsen @erikalarsen888 | Alicia Garza photographed in Oakland, California, January 11, 2019. Alicia Garza is a civil rights activist, writer, and co-founded the Black Lives Matter movement. In anticipation of the 100th anniversary of the 19th amendment, National Geographic is highlighting what it means to be female. As part of that coverage we photographed luminaries from around the world.\n\nCheck out the link in our bio to learn about Nat Geo’s groundbreaking new book that showcases an incredible group of history-making women. #NatGeoWomenofImpact'","['hair', 'white', 'shoulder', 'beauty', 'skin', 'hairstyle', 'lady', 'joint', 'lip', 'long', 'hair']",hair white shoulder beauty skin hairstyle lady joint lip long hair,0.15106570188562965,0.11700084504878236,0.13062678778352127,1,"Photo by Erika Larsen @erikalarsen888 | Alicia Garza photographed in Oakland, California, January 11, 2019. Alicia Garza is a civil rights activist, writer, and co-founded the Black Lives Matter movement. In anticipation of the 100th anniversary of the 19th amendment, National Geographic is highlighting what it means to be female. As part of that coverage we photographed luminaries from around the world.\n\nCheck out the link in our bio to learn about Nat Geo’s groundbreaking new book that showcases an incredible group of history-making women. #NatGeoWomenofImpact' hair white shoulder beauty skin hairstyle lady joint lip long hair","['hair', 'white', 'shoulder', 'beauty', 'skin', 'hairstyle', 'lady', 'joint', 'lip', 'long', 'hair']",0.01428607851266861,0.8714279532432556,0.014285745099186897,0.014285745099186897,0.014285745099186897,0.014285747893154621,0.014285745099186897,0.014285745099186897,0.014285745099186897,0.014285745099186897
226,242,https://instagram.fftw1-1.fna.fbcdn.net/v/t51.2885-15/fr/e15/s1080x1080/75576677_2458423480878657_6279229537310216283_n.jpg?_nc_ht=instagram.fftw1-1.fna.fbcdn.net&_nc_cat=109&oh=c632d48848b5f075a34b982ac280d91d&oe=5E7BDC39,1068,False,450900,"Photo by Cristina Mittermeier @Mitty | When this sperm whale, an old matriarch judging by the many scars in her body, started slowly swimming away, I found myself riding the strong current she created with her massive fluke. She knew I was right behind her, but she didn't seem to mind. More than once I thought about touching her, but as a wildlife photographer it's critical to pass through these moments as little more than a shadow. This is their world. So instead of giving in to my urge, I kept my distance and kept up with her slow swim for as long as I could, and then watched until she eventually disappeared into the warm waters off Dominica. Follow me @Mitty for more from my expeditions with @SeaLegacy that have changed me as an artist and a conservationist. #WhaleTail #SpermWhale #UnderwaterPhotography #ExtinctionEndsHere\n\nNat Geo is celebrating women who fearlessly push boundaries and inspire the next generation of changemakers. For a week, all of our posts and stories on @natgeo were photographed by women, about women. Use #NatGeoWomenofImpact to share how a woman in your life has empowered you.""","['water', 'white', 'black', 'and', 'white', 'monochrome', 'photography', 'leaf', 'sky', 'monochrome', 'photography', 'organism', 'wave']",water white black and white monochrome photography leaf sky monochrome photography organism wave,0.2790019045638994,0.08204655450564646,0.16082869452894766,1,"Photo by Cristina Mittermeier @Mitty | When this sperm whale, an old matriarch judging by the many scars in her body, started slowly swimming away, I found myself riding the strong current she created with her massive fluke. She knew I was right behind her, but she didn't seem to mind. More than once I thought about touching her, but as a wildlife photographer it's critical to pass through these moments as little more than a shadow. This is their world. So instead of giving in to my urge, I kept my distance and kept up with her slow swim for as long as I could, and then watched until she eventually disappeared into the warm waters off Dominica. Follow me @Mitty for more from my expeditions with @SeaLegacy that have changed me as an artist and a conservationist. #WhaleTail #SpermWhale #UnderwaterPhotography #ExtinctionEndsHere\n\nNat Geo is celebrating women who fearlessly push boundaries and inspire the next generation of changemakers. For a week, all of our posts and stories on @natgeo were photographed by women, about women. Use #NatGeoWomenofImpact to share how a woman in your life has empowered you."" water white black and white monochrome photography leaf sky monochrome photography organism wave","['water', 'white', 'black', 'white', 'monochrome', 'photography', 'leaf', 'sky', 'monochrome', 'photography', 'organism', 'wave']",0.12137683480978012,0.6297775506973267,0.009091959334909916,0.009091922082006931,0.009091507643461227,0.009092832915484905,0.00909350998699665,0.18520070612430573,0.009091385640203953,0.009091769345104694
