,Index,display_url,comments,is_video,likes,caption,labels,labels_strings,likes_normalized,comments_normalized,engagement_score,engagement,caption+labels,label_tokens,topic0,topic1,topic2,topic3,topic4,topic5,topic6,topic7,topic8,topic9
112,125,https://instagram.fftw1-1.fna.fbcdn.net/v/t51.2885-15/fr/e15/s1080x1080/71139120_725375124625871_1540923227713463873_n.jpg?_nc_ht=instagram.fftw1-1.fna.fbcdn.net&_nc_cat=111&oh=09fa83fb04e0d4d53dff128c067f65a3&oe=5E6F2AA2,1815,False,403973,"Photo by @gerdludwig | A couple takes a selfie in front of the most famous mural on the Berlin Wall, called ""The Kiss of Death"" by artist Dmitri Vrubel, which depicts the late Soviet premier Leonid Brezhnev kissing his East German counterpart, Erich Honecker.  November 9 marks the 30th anniversary of the fall of the 96-mile-long Berlin Wall, which physically divided East and West Berlin from 1969 to 1989.\n\nThe East Side Gallery, a 1.3-kilometer-long section of wall that once circled West Berlin, is now an international memorial to freedom. The paintings document a time of change and express hopes for a better, more open future for the entire world. @natgeoimagecollection @thephotosociety #BerlinWall #Berlin #Germany'","['wall', 'street', 'art', 'art', 'poster', 'mural', 'graffiti', 'advertising']",wall street art art poster mural graffiti advertising,0.2499650396815084,0.13943304908965198,0.18364584532639455,1,"Photo by @gerdludwig | A couple takes a selfie in front of the most famous mural on the Berlin Wall, called ""The Kiss of Death"" by artist Dmitri Vrubel, which depicts the late Soviet premier Leonid Brezhnev kissing his East German counterpart, Erich Honecker.  November 9 marks the 30th anniversary of the fall of the 96-mile-long Berlin Wall, which physically divided East and West Berlin from 1969 to 1989.\n\nThe East Side Gallery, a 1.3-kilometer-long section of wall that once circled West Berlin, is now an international memorial to freedom. The paintings document a time of change and express hopes for a better, more open future for the entire world. @natgeoimagecollection @thephotosociety #BerlinWall #Berlin #Germany' wall street art art poster mural graffiti advertising","['wall', 'street', 'art', 'art', 'poster', 'mural', 'graffiti', 'advertising']",0.6999958753585815,0.033333390951156616,0.033333390951156616,0.033333390951156616,0.033333390951156616,0.033333390951156616,0.033333390951156616,0.033333390951156616,0.03333701938390732,0.033333390951156616
113,127,https://instagram.fftw1-1.fna.fbcdn.net/v/t51.2885-15/fr/e15/p1080x1080/72761018_149427383124567_6011436220764338209_n.jpg?_nc_ht=instagram.fftw1-1.fna.fbcdn.net&_nc_cat=103&oh=da50d1c7d6909c0e4d92097fdc4e2f2b&oe=5E8CC2FB,1006,False,313931,"Photo by William Daniels @williamodaniels | A clown dressed as a pregnant woman dances in Bangassou, Central African Republic, as part of the festivities during the presidential election campaign—an event celebrated all over the country with music, dance, and performances. After the initial post-election hope and euphoria, the country soon sunk back into chaos. It has been affected by sectarian violence and a humanitarian crisis since 2013. Follow me on @williamodaniels for more human stories around the world.'","['people', 'adaptation', 'event', 'tribe', 'crowd']",people adaptation event tribe crowd,0.19425004857318587,0.07728355227779059,0.1240701507959487,1,"Photo by William Daniels @williamodaniels | A clown dressed as a pregnant woman dances in Bangassou, Central African Republic, as part of the festivities during the presidential election campaign—an event celebrated all over the country with music, dance, and performances. After the initial post-election hope and euphoria, the country soon sunk back into chaos. It has been affected by sectarian violence and a humanitarian crisis since 2013. Follow me on @williamodaniels for more human stories around the world.' people adaptation event tribe crowd","['people', 'adaptation', 'event', 'tribe', 'crowd']",0.020001474767923355,0.020001180469989777,0.0200014878064394,0.020001236349344254,0.020000968128442764,0.02000012993812561,0.020000040531158447,0.020000040531158447,0.819993257522583,0.020000174641609192
114,128,https://instagram.fftw1-1.fna.fbcdn.net/v/t51.2885-15/fr/e15/s1080x1080/74898934_1388230824664698_5012593492047776024_n.jpg?_nc_ht=instagram.fftw1-1.fna.fbcdn.net&_nc_cat=106&oh=0f81e29d4f42ed8f09fc7c7c101f639c&oe=5E6F3C40,565,False,188522,"Photo by Nichole Sobecki @nicholesobecki | There’s something gorgeous to me about this moment of temporary flight. In this small apartment in Zimbabwe’s first high-density township, Mbare, three generations of women and children gather in the room where they study, laugh, and sleep. The mother and grandmother did laundry to support them all, but through a child's imagination this green washing pail had been transformed. Gone were the suds and dirty clothes—this was an airplane going to a destination unknown. #highflyer #mbare #zimbabwe #women""","['people', 'red', 'child', 'fun', 'adaptation', 'room', 'leisure', 'event', 'photography', 'vacation']",people red child fun adaptation room leisure event photography vacation,0.1166511356225226,0.04340477836675117,0.07270332126905975,0,"Photo by Nichole Sobecki @nicholesobecki | There’s something gorgeous to me about this moment of temporary flight. In this small apartment in Zimbabwe’s first high-density township, Mbare, three generations of women and children gather in the room where they study, laugh, and sleep. The mother and grandmother did laundry to support them all, but through a child's imagination this green washing pail had been transformed. Gone were the suds and dirty clothes—this was an airplane going to a destination unknown. #highflyer #mbare #zimbabwe #women"" people red child fun adaptation room leisure event photography vacation","['people', 'red', 'child', 'fun', 'adaptation', 'room', 'leisure', 'event', 'photography', 'vacation']",0.0100008025765419,0.010001524351537228,0.4179718792438507,0.01000033225864172,0.010000264272093773,0.010000258684158325,0.01000002957880497,0.01000002957880497,0.50202476978302,0.010000077076256275
115,129,https://instagram.fftw1-1.fna.fbcdn.net/v/t51.2885-15/fr/e15/s1080x1080/74403393_542727966271972_1476507061557321577_n.jpg?_nc_ht=instagram.fftw1-1.fna.fbcdn.net&_nc_cat=104&oh=077a66f8282ce73ff524c7f378f0b0c0&oe=5E788A15,442,False,203040,"Photo by Ami Vitale @amivitale | Children from the village of Katumbi play and collect water near Lake Tanganyika, on the western edge of Tanzania. In 2011 and 2016, I went here with @nature_africa to photograph the Tuungane Project, which aims to create healthier families, fisheries, and forests. Here, only 1 in 10 girls finish secondary school, due to pregnancies, the time spent getting to school, or other challenges. But staying in school means these girls typically marry and start having children at a later age, and education provides women more opportunities to become employed, earn an income, and reduce their overall reliance on natural resources. In early 2019, @nature_africa donors built a life-changing, 80-bed girls’ dormitory next to Lagosa Secondary School. Girls who otherwise had no time to study due to long walks to school or faced other hardships at home now have a safe place to live and learn. Learn more by following @amivitale @nature_africa @thephotosociety and @nature_org\n#girls #letgirlslearn #tanzania #africa'","['people', 'water', 'jumping', 'fun', 'child', 'human', 'happy', 'play', 'adaptation', 'photography']",people water jumping fun child human happy play adaptation photography,0.12563439055811518,0.03395559652761773,0.0706271141398167,0,"Photo by Ami Vitale @amivitale | Children from the village of Katumbi play and collect water near Lake Tanganyika, on the western edge of Tanzania. In 2011 and 2016, I went here with @nature_africa to photograph the Tuungane Project, which aims to create healthier families, fisheries, and forests. Here, only 1 in 10 girls finish secondary school, due to pregnancies, the time spent getting to school, or other challenges. But staying in school means these girls typically marry and start having children at a later age, and education provides women more opportunities to become employed, earn an income, and reduce their overall reliance on natural resources. In early 2019, @nature_africa donors built a life-changing, 80-bed girls’ dormitory next to Lagosa Secondary School. Girls who otherwise had no time to study due to long walks to school or faced other hardships at home now have a safe place to live and learn. Learn more by following @amivitale @nature_africa @thephotosociety and @nature_org\n#girls #letgirlslearn #tanzania #africa' people water jumping fun child human happy play adaptation photography","['people', 'water', 'jumping', 'fun', 'child', 'human', 'happy', 'play', 'adaptation', 'photography']",0.3758479058742523,0.012504751794040203,0.5241321921348572,0.012500696815550327,0.012500879354774952,0.012500672601163387,0.012500434182584286,0.012506920844316483,0.012505226768553257,0.012500308454036713
116,130,https://instagram.fftw1-1.fna.fbcdn.net/v/t51.2885-15/fr/e15/s1080x1080/67679497_455737038384703_3766203492665164491_n.jpg?_nc_ht=instagram.fftw1-1.fna.fbcdn.net&_nc_cat=107&oh=566089807298d30d0a42019fa634ef5e&oe=5E864747,1089,False,487830,"Photo by Trevor Frost @tbfrost | Two male scarlet macaws skirmish over access to a clay lick in Yasuni National Park, Ecuador. Recent research suggests macaws visit these clay licks for the sodium deposited in the clay. Follow @tbfrost for more photos of wildlife from the Amazon.'","['vertebrate', 'bird', 'macaw', 'parrot', 'beak', 'adaptation', 'wing', 'organism', 'lovebird', 'budgie']",vertebrate bird macaw parrot beak adaptation wing organism lovebird budgie,0.30185295875672447,0.08365982945379119,0.1709370811749645,1,"Photo by Trevor Frost @tbfrost | Two male scarlet macaws skirmish over access to a clay lick in Yasuni National Park, Ecuador. Recent research suggests macaws visit these clay licks for the sodium deposited in the clay. Follow @tbfrost for more photos of wildlife from the Amazon.' vertebrate bird macaw parrot beak adaptation wing organism lovebird budgie","['vertebrate', 'bird', 'macaw', 'parrot', 'beak', 'adaptation', 'wing', 'organism', 'lovebird', 'budgie']",0.016675451770424843,0.016666749492287636,0.016667701303958893,0.41606876254081726,0.016667507588863373,0.016666749492287636,0.016666749492287636,0.016666749492287636,0.45058679580688477,0.016666749492287636
117,131,https://instagram.fftw1-1.fna.fbcdn.net/v/t51.2885-15/fr/e15/p1080x1080/73372133_715089492301392_7139500847245420235_n.jpg?_nc_ht=instagram.fftw1-1.fna.fbcdn.net&_nc_cat=100&oh=7908b5da874d443fe0643efda9ac8a57&oe=5E7D0E80,1000,False,429343,"Photo by Keith Ladzinski @ladzinski | Staring into the clouds and discovering shapes, faces, and structures is something we all likely did as children. It’s a form of pattern identification, the term for which is pareidolia. It’s a perfectly normal human tendency for identifying objects rapidly, like the face looking downward that many of you may see in this cloud formation. It’s a portal into the imagination, tapped when we look at art and iconic formations in national parks where we see signs for things like “owl rock” and “kissing camels.” #pareidolia'","['sky', 'cloud', 'daytime', 'atmosphere', 'cumulus', 'atmospheric', 'phenomenon', 'geological', 'phenomenon', 'evening', 'meteorological', 'phenomenon', 'orange']",sky cloud daytime atmosphere cumulus atmospheric phenomenon geological phenomenon evening meteorological phenomenon orange,0.26566315083428316,0.07682261657832065,0.15235883028070565,1,"Photo by Keith Ladzinski @ladzinski | Staring into the clouds and discovering shapes, faces, and structures is something we all likely did as children. It’s a form of pattern identification, the term for which is pareidolia. It’s a perfectly normal human tendency for identifying objects rapidly, like the face looking downward that many of you may see in this cloud formation. It’s a portal into the imagination, tapped when we look at art and iconic formations in national parks where we see signs for things like “owl rock” and “kissing camels.” #pareidolia' sky cloud daytime atmosphere cumulus atmospheric phenomenon geological phenomenon evening meteorological phenomenon orange","['sky', 'cloud', 'daytime', 'atmosphere', 'cumulus', 'atmospheric', 'phenomenon', 'geological', 'phenomenon', 'evening', 'meteorological', 'phenomenon', 'orange']",0.016666697338223457,0.016666697338223457,0.016666950657963753,0.016666697338223457,0.01666691154241562,0.016668010503053665,0.8499953150749207,0.01666775345802307,0.016667041927576065,0.01666787452995777
118,132,https://instagram.fftw1-1.fna.fbcdn.net/v/t51.2885-15/e35/s1080x1080/72759134_1381707448659380_3909421850221215045_n.jpg?_nc_ht=instagram.fftw1-1.fna.fbcdn.net&_nc_cat=108&oh=4f75e8ed4247f2cf535e5be80e71a6c1&oe=5E783B03,456,False,151333,"Photo by Saumya Khandelwal @khandelwal_saumya | Dussehra is a Hindu festival celebrating the victory of Lord Ram over the demon king Ravana. For Hindus it symbolizes the victory of good over evil. In the 10 days leading up to the festival, the theatrical performance of the Hindu scripture of Ramayana, called Ramlila, takes place across northern India, which concludes in the burning of the effigy of the demon king on the last day of Dussehra. \nIn Old Delhi the actors dress up as characters from the scriptures and make processions on the street surrounded by traditional music bands. People throng the streets to look at the actors as if they were real gods. \n#festival #hinduism #india'","['people', 'event', 'tradition', 'ritual', 'temple', 'ceremony']",people event tradition ritual temple ceremony,0.09363982085466531,0.03503111315971422,0.05847459623769466,0,"Photo by Saumya Khandelwal @khandelwal_saumya | Dussehra is a Hindu festival celebrating the victory of Lord Ram over the demon king Ravana. For Hindus it symbolizes the victory of good over evil. In the 10 days leading up to the festival, the theatrical performance of the Hindu scripture of Ramayana, called Ramlila, takes place across northern India, which concludes in the burning of the effigy of the demon king on the last day of Dussehra. \nIn Old Delhi the actors dress up as characters from the scriptures and make processions on the street surrounded by traditional music bands. People throng the streets to look at the actors as if they were real gods. \n#festival #hinduism #india' people event tradition ritual temple ceremony","['people', 'event', 'tradition', 'ritual', 'temple', 'ceremony']",0.020000431686639786,0.020001187920570374,0.02000032179057598,0.020000046119093895,0.020000046119093895,0.020000135526061058,0.020000046119093895,0.020000046119093895,0.8199975490570068,0.02000018022954464
119,133,https://instagram.fftw1-1.fna.fbcdn.net/v/t51.2885-15/e35/p1080x1080/75403181_2394268410811315_6066172865276292752_n.jpg?_nc_ht=instagram.fftw1-1.fna.fbcdn.net&_nc_cat=107&oh=13a9ef22d1839c4ef580167f57195450&oe=5E6C06DE,2611,False,762304,"Photos by Jimmy Chin @jimmychin | We have been on a wild ride with @freesolofilm over the last year. Coming out the other side of an amazing theatrical release and awards run (a BAFTA, 7 Emmys, and an Oscar), it’s still safe to say that bearing witness and documenting @alexhonnold's process of preparation and eventual free solo of Yosemite's El Cap still easily remains the wildest part of that ride. While we tried to manage the pressure of making the film and doing our best to shield Alex from the pressures of production, nothing compares to what Alex managed over those two years and particularly on June 3, 2017. We have all been incredibly grateful for the connection people have had with the film—there is truly no more a film team could ask for. Excited to share that Free Solo will be launching again November 12 on Disney +. Here are a few moments from the magazine assignment to celebrate the upcoming release and new life for Free Solo.""","['sky', 'nature', 'mountainous', 'landforms', 'natural', 'landscape', 'mountain', 'cloud', 'geological', 'phenomenon', 'rock', 'wilderness', 'national', 'park']",sky nature mountainous landforms natural landscape mountain cloud geological phenomenon rock wilderness national park,0.4716883296887975,0.20058385188599523,0.3090256430071161,1,"Photos by Jimmy Chin @jimmychin | We have been on a wild ride with @freesolofilm over the last year. Coming out the other side of an amazing theatrical release and awards run (a BAFTA, 7 Emmys, and an Oscar), it’s still safe to say that bearing witness and documenting @alexhonnold's process of preparation and eventual free solo of Yosemite's El Cap still easily remains the wildest part of that ride. While we tried to manage the pressure of making the film and doing our best to shield Alex from the pressures of production, nothing compares to what Alex managed over those two years and particularly on June 3, 2017. We have all been incredibly grateful for the connection people have had with the film—there is truly no more a film team could ask for. Excited to share that Free Solo will be launching again November 12 on Disney +. Here are a few moments from the magazine assignment to celebrate the upcoming release and new life for Free Solo."" sky nature mountainous landforms natural landscape mountain cloud geological phenomenon rock wilderness national park","['sky', 'nature', 'mountainous', 'landforms', 'natural', 'landscape', 'mountain', 'cloud', 'geological', 'phenomenon', 'rock', 'wilderness', 'national', 'park']",0.010000023990869522,0.01000005193054676,0.010000105015933514,0.010000023990869522,0.010002213530242443,0.010000530630350113,0.9099960923194885,0.010000357404351234,0.010000383481383324,0.010000230744481087
120,134,https://instagram.fftw1-1.fna.fbcdn.net/v/t51.2885-15/fr/e15/p1080x1080/74333551_2424571671091379_5345337150836418535_n.jpg?_nc_ht=instagram.fftw1-1.fna.fbcdn.net&_nc_cat=111&oh=9ab43ef51a31ce59e63406c849746cab&oe=5E88BCE5,541,False,181868,"Photo by Natalie Keyssar @nataliekeyssar | Two members of Moni Dance, a Caracas-based neighborhood dance team, hop a fence on a rooftop in the Catia area after performing at the opening of a new basketball court—part of a violence prevention initiative. Cultural programs like Moni Dance have become all the more important amid Venezuela's ongoing crisis, where grassroots arts collectives create a space for normalcy and empowerment.""","['leg', 'thigh', 'joint', 'muscle', 'knee', 'human', 'leg', 'hip']",leg thigh joint muscle knee human leg hip,0.11253386200760093,0.041561035568871474,0.06995016614436325,0,"Photo by Natalie Keyssar @nataliekeyssar | Two members of Moni Dance, a Caracas-based neighborhood dance team, hop a fence on a rooftop in the Catia area after performing at the opening of a new basketball court—part of a violence prevention initiative. Cultural programs like Moni Dance have become all the more important amid Venezuela's ongoing crisis, where grassroots arts collectives create a space for normalcy and empowerment."" leg thigh joint muscle knee human leg hip","['leg', 'thigh', 'joint', 'muscle', 'knee', 'human', 'leg', 'hip']",0.5499899983406067,0.05000938102602959,0.05000007152557373,0.05000007152557373,0.05000007152557373,0.05000007152557373,0.05000007152557373,0.05000007152557373,0.05000007152557373,0.05000007152557373
121,135,https://instagram.fftw1-1.fna.fbcdn.net/v/t51.2885-15/fr/e15/s1080x1080/76866794_2767165736640606_2714524668778178470_n.jpg?_nc_ht=instagram.fftw1-1.fna.fbcdn.net&_nc_cat=106&oh=58834986ea3d97864ef55dc166af7663&oe=5E797AF8,303,False,150895,"Photo by Simon Roberts @simoncroberts | Charity staff demonstrate shelter construction techniques to communities in the city of Tacloban, Philippines, affected by Typhoon Haiyan. Each year, natural disasters damage or destroy the homes of hundreds of thousands of people worldwide. On November 8, 2013, Typhoon Haiyan wreaked havoc across much of the central Philippines. In the city of Tacloban, thousands of people were killed when the storm surge destroyed dwellings.  #typhoonhaiyan #taclobancity'","['tourism', 'tree', 'community', 'crowd', 'hill', 'station', 'leisure', 'summer', 'travel', 'fun', 'plant']",tourism tree community crowd hill station leisure summer travel fun plant,0.09336880104051808,0.02327725282323116,0.051313872110145924,0,"Photo by Simon Roberts @simoncroberts | Charity staff demonstrate shelter construction techniques to communities in the city of Tacloban, Philippines, affected by Typhoon Haiyan. Each year, natural disasters damage or destroy the homes of hundreds of thousands of people worldwide. On November 8, 2013, Typhoon Haiyan wreaked havoc across much of the central Philippines. In the city of Tacloban, thousands of people were killed when the storm surge destroyed dwellings.  #typhoonhaiyan #taclobancity' tourism tree community crowd hill station leisure summer travel fun plant","['tourism', 'tree', 'community', 'crowd', 'hill', 'station', 'leisure', 'summer', 'travel', 'fun', 'plant']",0.012500102631747723,0.012500323355197906,0.24077796936035156,0.012500102631747723,0.3874940574169159,0.012500710785388947,0.012503386475145817,0.012500102631747723,0.28422310948371887,0.012500102631747723
122,136,https://instagram.fftw1-1.fna.fbcdn.net/v/t51.2885-15/fr/e15/s1080x1080/72869364_3472829329401692_2989319317747921509_n.jpg?_nc_ht=instagram.fftw1-1.fna.fbcdn.net&_nc_cat=108&oh=94e6f22cb0ef3a4ba31b148705179acf&oe=5E7C6EC3,1628,False,448904,"Photo by Cristina Mittermeier @Mitty | As a mother, I am keenly aware of what it takes to raise the next generation. Perhaps that’s why I feel such empathy for the struggles of mothers in the wild. A harp seal mother does everything by herself. She gives birth on the ice where her pup will spend the first weeks of his life, suckling at her side until he is ready, around two weeks later, to slip over the lip of the ice and into the Arctic water. These pups are born without blubber, but they quickly pack it on from their mother's milk, which contains between 25% and 40% fat—the higher the fat content, the closer the pups are to leaving their mother's side. Pups grow from roughly 24 pounds at birth to 80 pounds by the time their mothers leave them to fend for themselves. Follow me @Mitty for more stories about animal mothers from the far corners of the world captured on @SeaLegacy expeditions. #Motherhood #HyrdateLike #Arctic #SeaIce""","['seal', 'mammal', 'harbor', 'seal', 'fur', 'seal', 'arctic', 'marine', 'mammal', 'natural', 'environment', 'steller', 'sea', 'lion', 'earless', 'seal', 'ice']",seal mammal harbor seal fur seal arctic marine mammal natural environment steller sea lion earless seal ice,0.2777668462327627,0.12506721978950602,0.18614707036680872,1,"Photo by Cristina Mittermeier @Mitty | As a mother, I am keenly aware of what it takes to raise the next generation. Perhaps that’s why I feel such empathy for the struggles of mothers in the wild. A harp seal mother does everything by herself. She gives birth on the ice where her pup will spend the first weeks of his life, suckling at her side until he is ready, around two weeks later, to slip over the lip of the ice and into the Arctic water. These pups are born without blubber, but they quickly pack it on from their mother's milk, which contains between 25% and 40% fat—the higher the fat content, the closer the pups are to leaving their mother's side. Pups grow from roughly 24 pounds at birth to 80 pounds by the time their mothers leave them to fend for themselves. Follow me @Mitty for more stories about animal mothers from the far corners of the world captured on @SeaLegacy expeditions. #Motherhood #HyrdateLike #Arctic #SeaIce"" seal mammal harbor seal fur seal arctic marine mammal natural environment steller sea lion earless seal ice","['seal', 'mammal', 'harbor', 'seal', 'fur', 'seal', 'arctic', 'marine', 'mammal', 'natural', 'environment', 'steller', 'sea', 'lion', 'earless', 'seal', 'ice']",0.012502280995249748,0.012500045821070671,0.012500045821070671,0.012506644241511822,0.01250070333480835,0.012500045821070671,0.012500116601586342,0.5125347971916199,0.012500045821070671,0.3874552249908447
